<?xml version='1.0' encoding='UTF-8'?>
<?xml-stylesheet type="text/xsl" href="../Ressources/UnifiedStyleSheet_EN.xsl"?>
<!DOCTYPE InterferenceElement SYSTEM "../Ressources/InterferenceGrammar.dtd">
<InterferenceElement Version = "1.2" CATDocument = "C:\Users\Al\Dropbox\ESS\The Comparator\Nouveau dossier (2)\Product85.CATProduct" Responsible = "Al" FederatorFather = "..\sample.xml.xml"><Date Day = "28" Hour = "18" Year = "2016" Month = "2" Minute = "22" Second = "6"/><Interference Status = "Relevant" NumInterf = "57" ResultType = "Clash" RetrieveInf = "New" ResultTypeNoNLS = "Clash"><Comment Value = "Automatic filter : penetration less than "/>
<Product Alias = "79A5552 (79A5552.2)" Preview = "../Picture/28_2_2016_18_22_8_Preview_First_57.png" ShapeName = "Shape 1" ProcessMode = "STANDALONE" ShapeSource = "C:\Users\Al\Dropbox\ESS\The Comparator\Nouveau dossier (2)\79A5552.CATPart" DescriptionID = "B473299-501 --++-- B473210-501 --++-- Product1.3 --++-- 79A5552.2">
<Matrix>
<Vector Vx = "-0.979492" Vy = "0.000000" Vz = "0.201483" CorrespondingData = "Rx"/>
<Vector Vx = "0.000000" Vy = "1.000000" Vz = "-0.000000" CorrespondingData = "Ry"/>
<Vector Vx = "-0.201483" Vy = "-0.000000" Vz = "-0.979492" CorrespondingData = "Rz"/>
<Point Ux = "-408.758698" Uy = "2896.908203" Uz = "11018.072266"/>
</Matrix></Product>
<Product Alias = "NAS514P832-6P (NAS514P832-6P.1.3)" Preview = "../Picture/28_2_2016_18_22_8_Preview_Second_57.png" ShapeName = "Shape 1" ProcessMode = "STANDALONE" ShapeSource = "C:\Users\Al\Dropbox\ESS\The Comparator\Nouveau dossier (2)\NAS514P832-6P.CATPart" DescriptionID = "B473299-501 --++-- NAS514P832-6P.1.3">
<Matrix>
<Vector Vx = "0.040906" Vy = "-0.979173" Vz = "0.198862" CorrespondingData = "Rx"/>
<Vector Vx = "0.197287" Vy = "0.203026" Vz = "0.959092" CorrespondingData = "Ry"/>
<Vector Vx = "-0.979492" Vy = "0.000000" Vz = "0.201483" CorrespondingData = "Rz"/>
<Point Ux = "-413.915741" Uy = "2874.429199" Uz = "11008.760742"/>
</Matrix></Product>
<GeometricAspect ExtractOrDistValue = "-0.122in" IntersectCurveLength = "1.354in"><Point Ux = "-16.239in" Uy = "113.167in" Uz = "433.404in"/><Point Ux = "-16.12in" Uy = "113.166in" Uz = "433.378in"/></GeometricAspect><Picture HRef = "../Picture/28_2_2016_18_22_8_57.png"/></Interference></InterferenceElement>