<?xml version='1.0' encoding='UTF-8'?>
<?xml-stylesheet type="text/xsl" href="../Ressources/UnifiedStyleSheet_EN.xsl"?>
<!DOCTYPE InterferenceElement SYSTEM "../Ressources/InterferenceGrammar.dtd">
<InterferenceElement Version = "1.2" CATDocument = "C:\Users\Al\Dropbox\ESS\The Comparator\Nouveau dossier (2)\Product85.CATProduct" Responsible = "Al" FederatorFather = "..\sample.xml.xml"><Date Day = "28" Hour = "18" Year = "2016" Month = "2" Minute = "22" Second = "6"/><Interference Status = "NotInspected" NumInterf = "66" ResultType = "Contact" RetrieveInf = "New" ResultTypeNoNLS = "Contact"><Comment Value = ""/>
<Product Alias = "NAS1149FN632P (NAS1149FN632P.2)" Preview = "../Picture/28_2_2016_18_22_9_Preview_First_66.png" ShapeName = "Shape 1" ProcessMode = "STANDALONE" ShapeSource = "C:\Users\Al\Dropbox\ESS\The Comparator\Nouveau dossier (2)\NAS1149FN632P.CATPart" DescriptionID = "B473299-501 --++-- NAS1149FN632P.2">
<Matrix>
<Vector Vx = "0.000000" Vy = "0.026164" Vz = "0.999658" CorrespondingData = "Rx"/>
<Vector Vx = "0.000000" Vy = "-0.999658" Vz = "0.026164" CorrespondingData = "Ry"/>
<Vector Vx = "1.000000" Vy = "-0.000000" Vz = "-0.000000" CorrespondingData = "Rz"/>
<Point Ux = "-487.493561" Uy = "3028.984131" Uz = "10528.420898"/>
</Matrix></Product>
<Product Alias = "MS21042L06 (MS21042L06.2)" Preview = "../Picture/28_2_2016_18_22_9_Preview_Second_66.png" ShapeName = "Shape 1" ProcessMode = "STANDALONE" ShapeSource = "C:\Users\Al\Dropbox\ESS\The Comparator\Nouveau dossier (2)\MS21042L06.CATPart" DescriptionID = "B473299-501 --++-- MS21042L06.2">
<Matrix>
<Vector Vx = "0.000000" Vy = "0.000549" Vz = "1.000000" CorrespondingData = "Rx"/>
<Vector Vx = "0.000000" Vy = "1.000000" Vz = "-0.000549" CorrespondingData = "Ry"/>
<Vector Vx = "-1.000000" Vy = "0.000000" Vz = "0.000000" CorrespondingData = "Rz"/>
<Point Ux = "-486.680756" Uy = "3028.984131" Uz = "10528.420898"/>
</Matrix></Product>
<GeometricAspect ExtractOrDistValue = "0 mm" IntersectCurveLength = "0 mm"/><Picture HRef = "../Picture/28_2_2016_18_22_9_66.png"/></Interference></InterferenceElement>