<?xml version='1.0' encoding='UTF-8'?>
<?xml-stylesheet type="text/xsl" href="../Ressources/UnifiedStyleSheet_EN.xsl"?>
<!DOCTYPE InterferenceElement SYSTEM "../Ressources/InterferenceGrammar.dtd">
<InterferenceElement Version = "1.2" CATDocument = "C:\Users\Al\Dropbox\ESS\The Comparator\Nouveau dossier (2)\Product85.CATProduct" Responsible = "Al" FederatorFather = "..\sample.xml.xml"><Date Day = "28" Hour = "18" Year = "2016" Month = "2" Minute = "22" Second = "6"/><Interference Status = "NotInspected" NumInterf = "69" ResultType = "Contact" RetrieveInf = "New" ResultTypeNoNLS = "Contact"><Comment Value = ""/>
<Product Alias = "B473299-3 (B473299-3.1)" Preview = "../Picture/28_2_2016_18_22_9_Preview_First_69.png" ShapeName = "Shape 1" ProcessMode = "STANDALONE" ShapeSource = "C:\Users\Al\Dropbox\ESS\The Comparator\Nouveau dossier (2)\B473299-3.CATPart" DescriptionID = "B473299-501 --++-- B473299-3.1">
<Matrix>
<Vector Vx = "-0.000000" Vy = "-1.000000" Vz = "0.000000" CorrespondingData = "Rx"/>
<Vector Vx = "-1.000000" Vy = "0.000000" Vz = "0.000000" CorrespondingData = "Ry"/>
<Vector Vx = "-0.000000" Vy = "-0.000000" Vz = "-1.000000" CorrespondingData = "Rz"/>
<Point Ux = "-428.889587" Uy = "3279.394043" Uz = "11044.779297"/>
</Matrix></Product>
<Product Alias = "MS24693-S30 (MS24693-S30.2)" Preview = "../Picture/28_2_2016_18_22_9_Preview_Second_69.png" ShapeName = "Shape 1" ProcessMode = "STANDALONE" ShapeSource = "C:\Users\Al\Dropbox\ESS\The Comparator\Nouveau dossier (2)\MS24693-S30.CATPart" DescriptionID = "B473299-501 --++-- MS24693-S30.2">
<Matrix>
<Vector Vx = "1.000000" Vy = "0.000000" Vz = "0.000000" CorrespondingData = "Rx"/>
<Vector Vx = "0.000000" Vy = "0.000000" Vz = "1.000000" CorrespondingData = "Ry"/>
<Vector Vx = "0.000000" Vy = "-1.000000" Vz = "0.000000" CorrespondingData = "Rz"/>
<Point Ux = "-438.541595" Uy = "3263.519043" Uz = "11039.699219"/>
</Matrix></Product>
<GeometricAspect ExtractOrDistValue = "0 mm" IntersectCurveLength = "0 mm"/><Picture HRef = "../Picture/28_2_2016_18_22_9_69.png"/></Interference></InterferenceElement>