<?xml version='1.0' encoding='UTF-8'?>
<?xml-stylesheet type="text/xsl" href="../Ressources/UnifiedStyleSheet_EN.xsl"?>
<!DOCTYPE InterferenceElement SYSTEM "../Ressources/InterferenceGrammar.dtd">
<InterferenceElement Version = "1.2" CATDocument = "C:\Users\Al\Dropbox\ESS\The Comparator\Nouveau dossier (2)\Product85.CATProduct" Responsible = "Al" FederatorFather = "..\sample.xml.xml"><Date Day = "28" Hour = "18" Year = "2016" Month = "2" Minute = "22" Second = "6"/><Interference Status = "NotInspected" NumInterf = "60" ResultType = "Contact" RetrieveInf = "New" ResultTypeNoNLS = "Contact"><Comment Value = ""/>
<Product Alias = "408.11.550_RAIL 22 IN (RAIL 22 IN, HAFELE)" Preview = "../Picture/28_2_2016_18_22_8_Preview_First_60.png" ShapeName = "Shape 1" ProcessMode = "STANDALONE" ShapeSource = "C:\Users\Al\Dropbox\ESS\The Comparator\Nouveau dossier (2)\408.11.550_RAIL 22 IN.CATPart" DescriptionID = "B473299-501 --++-- B473210-501 --++-- Product1.3 --++-- 408.11.550.1 --++-- RAIL 22 IN, HAFELE">
<Matrix>
<Vector Vx = "0.000000" Vy = "1.000000" Vz = "0.000000" CorrespondingData = "Rx"/>
<Vector Vx = "0.000005" Vy = "0.000000" Vz = "-1.000000" CorrespondingData = "Ry"/>
<Vector Vx = "-1.000000" Vy = "0.000000" Vz = "-0.000005" CorrespondingData = "Rz"/>
<Point Ux = "-428.089264" Uy = "3157.343262" Uz = "11044.677734"/>
</Matrix></Product>
<Product Alias = "408.11.550_PLASTIC CAP (PLASTIC CAP)" Preview = "../Picture/28_2_2016_18_22_8_Preview_Second_60.png" ShapeName = "Shape 1" ProcessMode = "STANDALONE" ShapeSource = "C:\Users\Al\Dropbox\ESS\The Comparator\Nouveau dossier (2)\408.11.550_PLASTIC CAP.CATPart" DescriptionID = "B473299-501 --++-- B473210-501 --++-- Product1.3 --++-- 408.11.550.1 --++-- PLASTIC CAP">
<Matrix>
<Vector Vx = "0.000000" Vy = "1.000000" Vz = "0.000000" CorrespondingData = "Rx"/>
<Vector Vx = "1.000000" Vy = "-0.000000" Vz = "0.000005" CorrespondingData = "Ry"/>
<Vector Vx = "0.000005" Vy = "0.000000" Vz = "-1.000000" CorrespondingData = "Rz"/>
<Point Ux = "-445.551758" Uy = "3158.392822" Uz = "11044.510742"/>
</Matrix></Product>
<GeometricAspect ExtractOrDistValue = "0 mm" IntersectCurveLength = "0 mm"/><Picture HRef = "../Picture/28_2_2016_18_22_8_60.png"/></Interference></InterferenceElement>