<?xml version='1.0' encoding='UTF-8'?>
<?xml-stylesheet type="text/xsl" href="../Ressources/UnifiedStyleSheet_EN.xsl"?>
<!DOCTYPE InterferenceElement SYSTEM "../Ressources/InterferenceGrammar.dtd">
<InterferenceElement Version = "1.2" CATDocument = "C:\Users\Al\Dropbox\ESS\The Comparator\Nouveau dossier (2)\Product85.CATProduct" Responsible = "Al" FederatorFather = "..\sample.xml.xml"><Date Day = "28" Hour = "18" Year = "2016" Month = "2" Minute = "22" Second = "6"/><Interference Status = "Relevant" NumInterf = "73" ResultType = "Clash" RetrieveInf = "New" ResultTypeNoNLS = "Clash"><Comment Value = "Automatic filter : penetration less than "/>
<Product Alias = "TL1150 (TL1150 TOUCH LATCH.1)" Preview = "../Picture/28_2_2016_18_22_9_Preview_First_73.png" ShapeName = "Shape 1" ProcessMode = "STANDALONE" ShapeSource = "C:\Users\Al\Dropbox\ESS\The Comparator\Nouveau dossier (2)\TL1150.CATPart" DescriptionID = "B473299-501 --++-- TL1150SMP.1 --++-- TL1150 TOUCH LATCH.1">
<Matrix>
<Vector Vx = "-0.000000" Vy = "0.000000" Vz = "1.000000" CorrespondingData = "Rx"/>
<Vector Vx = "-0.000000" Vy = "-1.000000" Vz = "0.000000" CorrespondingData = "Ry"/>
<Vector Vx = "1.000000" Vy = "-0.000000" Vz = "0.000000" CorrespondingData = "Rz"/>
<Point Ux = "-525.976379" Uy = "3050.820557" Uz = "10528.420898"/>
</Matrix></Product>
<Product Alias = "TL1157 (TL1157.1)" Preview = "../Picture/28_2_2016_18_22_9_Preview_Second_73.png" ShapeName = "Shape 1" ProcessMode = "STANDALONE" ShapeSource = "C:\Users\Al\Dropbox\ESS\The Comparator\Nouveau dossier (2)\TL1157.CATPart" DescriptionID = "B473299-501 --++-- TL1150SMP.1 --++-- TL1157.1">
<Matrix>
<Vector Vx = "0.000000" Vy = "-1.000000" Vz = "0.000000" CorrespondingData = "Rx"/>
<Vector Vx = "-1.000000" Vy = "0.000000" Vz = "-0.000000" CorrespondingData = "Ry"/>
<Vector Vx = "0.000000" Vy = "-0.000000" Vz = "-1.000000" CorrespondingData = "Rz"/>
<Point Ux = "-490.233337" Uy = "3078.514160" Uz = "10534.771484"/>
</Matrix></Product>
<GeometricAspect ExtractOrDistValue = "-0.067in" IntersectCurveLength = "1.911in"><Point Ux = "-19.694in" Uy = "119.934in" Uz = "414.506in"/><Point Ux = "-19.628in" Uy = "119.934in" Uz = "414.506in"/></GeometricAspect><Picture HRef = "../Picture/28_2_2016_18_22_9_73.png"/></Interference></InterferenceElement>