<?xml version='1.0' encoding='UTF-8'?>
<?xml-stylesheet type="text/xsl" href="../Ressources/UnifiedStyleSheet_EN.xsl"?>
<!DOCTYPE InterferenceElement SYSTEM "../Ressources/InterferenceGrammar.dtd">
<InterferenceElement Version = "1.2" CATDocument = "C:\Users\Al\Dropbox\ESS\The Comparator\Nouveau dossier (2)\Product85.CATProduct" Responsible = "Al" FederatorFather = "..\sample.xml.xml"><Date Day = "28" Hour = "18" Year = "2016" Month = "2" Minute = "22" Second = "6"/><Interference Status = "NotInspected" NumInterf = "72" ResultType = "Contact" RetrieveInf = "New" ResultTypeNoNLS = "Contact"><Comment Value = ""/>
<Product Alias = "TL1156 (TL1156)" Preview = "../Picture/28_2_2016_18_22_9_Preview_First_72.png" ShapeName = "Shape 1" ProcessMode = "STANDALONE" ShapeSource = "C:\Users\Al\Dropbox\ESS\The Comparator\Nouveau dossier (2)\TL1156.CATPart" DescriptionID = "B473299-501 --++-- TL1150SMP.1 --++-- TL1156">
<Matrix>
<Vector Vx = "-0.000000" Vy = "0.000000" Vz = "1.000000" CorrespondingData = "Rx"/>
<Vector Vx = "-0.000000" Vy = "-1.000000" Vz = "0.000000" CorrespondingData = "Ry"/>
<Vector Vx = "1.000000" Vy = "-0.000000" Vz = "0.000000" CorrespondingData = "Rz"/>
<Point Ux = "-535.746399" Uy = "3063.520508" Uz = "10518.260742"/>
</Matrix></Product>
<Product Alias = "TL1150 (TL1150 TOUCH LATCH.1)" Preview = "../Picture/28_2_2016_18_22_9_Preview_Second_72.png" ShapeName = "Shape 1" ProcessMode = "STANDALONE" ShapeSource = "C:\Users\Al\Dropbox\ESS\The Comparator\Nouveau dossier (2)\TL1150.CATPart" DescriptionID = "B473299-501 --++-- TL1150SMP.1 --++-- TL1150 TOUCH LATCH.1">
<Matrix>
<Vector Vx = "-0.000000" Vy = "0.000000" Vz = "1.000000" CorrespondingData = "Rx"/>
<Vector Vx = "-0.000000" Vy = "-1.000000" Vz = "0.000000" CorrespondingData = "Ry"/>
<Vector Vx = "1.000000" Vy = "-0.000000" Vz = "0.000000" CorrespondingData = "Rz"/>
<Point Ux = "-525.976379" Uy = "3050.820557" Uz = "10528.420898"/>
</Matrix></Product>
<GeometricAspect ExtractOrDistValue = "0 mm" IntersectCurveLength = "0 mm"/><Picture HRef = "../Picture/28_2_2016_18_22_9_72.png"/></Interference></InterferenceElement>