<?xml version='1.0' encoding='UTF-8'?>
<?xml-stylesheet type="text/xsl" href="../Ressources/UnifiedStyleSheet_EN.xsl"?>
<!DOCTYPE InterferenceElement SYSTEM "../Ressources/InterferenceGrammar.dtd">
<InterferenceElement Version = "1.2" CATDocument = "C:\Users\Al\Dropbox\ESS\The Comparator\Nouveau dossier (2)\Product85.CATProduct" Responsible = "Al" FederatorFather = "..\sample.xml.xml"><Date Day = "28" Hour = "18" Year = "2016" Month = "2" Minute = "22" Second = "6"/><Interference Status = "NotInspected" NumInterf = "21" ResultType = "Contact" RetrieveInf = "New" ResultTypeNoNLS = "Contact"><Comment Value = ""/>
<Product Alias = "408.11.550_SUPPORT PLATE (SUPPORT PLATE,  HAFELE SLIDE)" Preview = "../Picture/28_2_2016_18_22_7_Preview_First_21.png" ShapeName = "Shape 1" ProcessMode = "STANDALONE" ShapeSource = "C:\Users\Al\Dropbox\ESS\The Comparator\Nouveau dossier (2)\408.11.550_SUPPORT PLATE.CATPart" DescriptionID = "B473299-501 --++-- 408.11.550.2 --++-- SUPPORT PLATE,  HAFELE SLIDE">
<Matrix>
<Vector Vx = "0.000000" Vy = "-1.000000" Vz = "-0.000000" CorrespondingData = "Rx"/>
<Vector Vx = "0.000005" Vy = "0.000000" Vz = "-1.000000" CorrespondingData = "Ry"/>
<Vector Vx = "1.000000" Vy = "-0.000000" Vz = "0.000005" CorrespondingData = "Rz"/>
<Point Ux = "-509.470886" Uy = "2937.746094" Uz = "11044.677734"/>
</Matrix></Product>
<Product Alias = "175H710-180 (175H710-180.2)" Preview = "../Picture/28_2_2016_18_22_7_Preview_Second_21.png" ShapeName = "Shape 1" ProcessMode = "STANDALONE" ShapeSource = "C:\Users\Al\Dropbox\ESS\The Comparator\Nouveau dossier (2)\175H710-180.CATPart" DescriptionID = "B473299-501 --++-- B473210-501 --++-- Product1.3 --++-- 175H710-180.2">
<Matrix>
<Vector Vx = "0.000000" Vy = "-1.000000" Vz = "0.000000" CorrespondingData = "Rx"/>
<Vector Vx = "-1.000000" Vy = "0.000000" Vz = "-0.000005" CorrespondingData = "Ry"/>
<Vector Vx = "0.000005" Vy = "0.000000" Vz = "-1.000000" CorrespondingData = "Rz"/>
<Point Ux = "-469.901947" Uy = "2896.908203" Uz = "11032.886719"/>
</Matrix></Product>
<GeometricAspect ExtractOrDistValue = "0 mm" IntersectCurveLength = "0 mm"/><Picture HRef = "../Picture/28_2_2016_18_22_7_21.png"/></Interference></InterferenceElement>